1061302547531603969	jpmorgan	1541869220000	7	39	This #CodeForGood season flew by! We held our last event of the season in #London this weekend, where student coders and $JPM technologists built solutions for @Julias_House, @TheMixUK, @BrainTumourOrg, and @AutisticaUK.pic.twitter.com/U5ENeTS5Se
1061248106698702849	jpmorgan	1541856240000	5	17	From the $JPM Art Collection exhibit, This Must Be The Place, at #ParisPhoto2018:  Joni Sternbach's"Los Caballero de las Olas" (CowBoys of the Waves).pic.twitter.com/QPR2cC4k2T
1060987925762998272	ChrisDenk	1541794208000	7	12	$MGON Is about to drop filings! BUY ALERT #MMJ $MSFT $BABA $SBUX $TSN $FB $SMAR $TLRY $GIS $WFM $NIO $LULU $TSLA $YUM $TWTR $AMZN $CSCO $NFLX $BA $CRM $SQ $SVMK $CMG $VMW $BAC $JPM $STX $F $COST $YELP #OTC #NASDAQ #CNBC #StockMarket #StockMarketNews #Stocks #Stock #L2 #investinghttps://twitter.com/MegolaMMJ/status/1060560887604502529 …
1060984306435309568	bradloncar	1541793345000	2	18	Every year at JPM I buy @sbancel a beer. If he raises $500M for this IPO, I think I’m going to let him pay next time.
1060975088722477056	Chase	1541791147000	3	26	Meet Mazda  She launched the first Military Veterans Internship Program at $JPM with the help of her colleagues and non-profit partners. “My favorite part of my job is helping people be the best version of themselves.” #FacesOfChase
1060950602920984576	zeroleverage	1541785309000	6	36	I try to find #Kolanovic head of #JPM trading strategies during the last 4 weeks has predicted 4 different times a strong bullish rally. Who cares anymore for Gartman ? Markets have find the new clown who answers to the name Kolanovic . What a scam ! https://twitter.com/zeroleverage/status/1055115852763291649?s=19 …pic.twitter.com/e8c4D1HFBL
1060948935974547457	CharlesOrtel	1541784912000	22	31	If true @generalelectric then reveal balance sheet and cash flow details broken out nation by nation for 2016 and 2017. What is the TRUE position of the "parent company guarantor"? And how have you estimated values of contingent liabilities. JPM is 2 nice! https://www.cnbc.com/2018/11/09/ge-responds-to-jp-morgan-price-cut-as-shares-plummet.html …
1060876914192211976	pharris667	1541767741000	8	12	$TSLA Cut @ JPM to $195.00 From $308.00 PT
1060867327196061696	carlquintanilla	1541765455000	9	34	JPM’s Tusa cuts his $GE target to $6 — days after fellow, longtime analyst John Inch cut his to $5.  @CNBCpic.twitter.com/onXwWpsRba
1060858751278821376	zerohedge	1541763410000	21	54	GE SHARES FALL 3.3% TO TRADE BELOW $9 PER SHARE AS JPM CRUSADE TO CRUSH THE COMPANY CONTINUES
1060679556305248256	cristiannmillo	1541720687000	7	45	$CEPU: OW por JPM. Price target 2019E: u$s 15. pic.twitter.com/smYLLZ7rsH
1060588723124006912	PatrickW	1541699031000	22	29	JPM economist: Measured against the economy's strength, GOP losses in the House mark the worst midterm results for a president's own party in at least a century. https://www.washingtonpost.com/news/powerpost/paloma/the-finance-202/2018/11/08/the-finance-202-the-president-s-party-just-suffered-a-historically-big-wipeout-during-a-strong-economy/5be3270f1b326b392905466b/?utm_term=.632096aa99dc …pic.twitter.com/UI3yN0fBWS
1060555354495467521	carlquintanilla	1541691075000	105	147	We're going to see more retail store closures, more bankruptcies in the next two years than we've seen in the last five, says JPM's Boss, on @CNBC $RLX @SquawkStreet
1060450529208426496	TweetsMillenia	1541666083000	7	10	Gold, Silver, Platinum, Palladium SPOOFING PLOT  Justice Dept said JPM traders sought to manipulate future markets for PM on Nymex Comex x 6 yrs Chart to Feb 2018 shows JPM from 0 to 133m oz in 7 yrs As Nov 5 $JPM holds 152m oz  https://www.cmegroup.com/delivery_reports/Silver_stocks.xls … WHAT ARE THEY UP TO? $SLVpic.twitter.com/jlzE8Dslp1
1060217198420082689	BNIRoman	1541610452000	5	7	Busy day @BNIRoman - Tristan from @HarteyWM explained all about what sets them apart  as #wealthmanagers Katy joined as a new member #mortgageadvisor from @IngardBroker Steve from @chestertweetsuk was our  notablenetworker Jamie @jpm_ltd  won the 60 second cup #chestertweetspic.twitter.com/kVEsJ9tLGe
1060170539665424385	stacyherbert	1541599328000	148	275	For years, cranks told us that "for every buyer, there is a seller," so, ipso facto, there can be NO manipulation of precious metals prices. Bizarrely, therefore, a JPM trader has just pleaded guilty to, um . . . manipulating prices. https://www.cnbc.com/2018/11/06/ex-jp-morgan-trader-pleads-guilty-to-manipulating-metals-markets.html … @maxkeiser
1060117154584944640	jpmorgan	1541586600000	11	28	This Must Be the Place: The $JPM Art Collection exhibit at @ParisPhotoFair transports us from the 19th century to present day.
1059917539281645568	TFMetals	1541539008000	67	156	So let's summarize... 1) JPM traders manipulate price. 2) JPM amasses hoard at low prices. 3) JPM uses hoard to justify continued manipulation through "hedging". All the while, chief regulator @CFTC turns a blind eye and finds no wrongdoing. It's good work if you can get it.
1059915842052411398	TFMetals	1541538603000	13	23	Another new high for the amount of silver held in JPM's Comex vault. From ZERO and NO VAULT in the spring of 2011 to 151.6MM ounces (or 4,700 metric tonnes) representing 52.2% of the TOTAL COMEX VAULT in 2018. pic.twitter.com/evHs8Eu0A7
1059815854576066560	camanpour	1541514764000	66	148	EXCLUSIVE: $JPM CEO Jamie Dimon tells me that “there will be another recession” in the next few years but that the US economy is “very strong.” pic.twitter.com/7dqpMvJNsT
1059815301095710720	camanpour	1541514632000	30	63	EXCLUSIVE: On the day $JPM launches a $30 million investment in under-served Paris suburbs, CEO Jamie Dimon tells me that there are “legitimate complaints” underpinning populism, and that “all of us have a vested interest in making communities better.” pic.twitter.com/FmEfoW7LTc
1059698732625813504	Research_Turkey	1541486840000	11	13	JPM/Turkey: inflation likely reached its cyclical peak in October We expect the CBRT to keep the rate unchanged until the end of the first half of 2019. We expect the first move to be a 100bp cut as yearly inflation starts its descent in June. pic.twitter.com/5UpNvwMntX
1059606380846477313	KathrynTappen	1541464822000	10	141	All he asked for was an open bar and a huge celebration of his life. Well... 600+ people later, think JPM got it. “We love you John!”   @teamcafemartin #CafeMartin #StrikeOutALS :… https://www.instagram.com/p/Bp0bDBAgg5t/?utm_source=ig_twitter_share&igshid=f5p0cza2a517 …
1059476403320750081	ukarlewitz	1541433833000	7	36	Valuation: price/sales (and its cousin, price/GDP) are not very informative because profitability increases over time (up 50% since 2000; from JPM) pic.twitter.com/keKebNOKkZ
1059475545216274432	ukarlewitz	1541433628000	31	70	Default rates remain very low. Spreads (gray line) widen ahead of a recession; they're not widening right now (from JPM) pic.twitter.com/DxGVbiGvGe
1059372288389218304	denvern3	1541409010000	17	67	1. Mthuli hires Acie 2. Acie says KTagwireyi is Queen B 3. RBZ directors suspended after live vid by Acie 4. Sakunda gives Gvt fuel worth 100mln 5. Acie comes back now says Tagwireyi is not Queen B but JPM is 6. Initially it was RBZ directors are thieves JPM is clean
1059280952571125760	crabbermike	1541387234000	14	20	$FUSZ @nFuszInc is going places! Latest BOD to join, Chuckie Reddy @jpmorgan $JPM Just after Ex @Microsoft #CIO @Jim_M_DuBois  "I have worked with many young, high-growth companies. I'm thrilled to be joining the advisory team and offer my FINANCIAL AND M&A EXPERTISE." #stocks
1059181016659705857	mmawere	1541363407000	15	74	Quiz of the day: How much do you think Acie has been paid to substitute JPM for Kuda Tagwirei as Queen B?
1059180132454334465	mmawere	1541363196000	9	21	Acie applogizes to Kuda Tagwirei yet confesses that at all material times, Queen B was JPM. Who then paid Acie to implicate Tagwirei and for whose benefit? If JPM was Queen B then Acie needs therapy of the mind. Who is being played here? Why are the retail public so gullible? pic.twitter.com/7U5666AlXf
1059177900400955393	mmawere	1541362664000	9	17	Did you know that Queen B is not Kuda Tagwirei but JPM? pic.twitter.com/FyPfThP21T
1058743577105387520	LuckyHappens	1541259113000	6	14	$NHPI If you love money and know what a REVERSE MERGER is then you should take a loot at $NHPI  $FB $GOOGL $JPM $BAC $WFC $AAPL $PM $PG $GE $HON $JNJ $CSCO $MSFT $TWTR $TSLA $DIS $UNH $VZ $KHC $XOM $LMT $WMT $TGT $AMZN $IBM $SPX $N $FTSE $GS $F $C $A $D $E $G $H $I $J $K $L $M
1058600435655827456	TCommodity	1541224986000	12	13	Iranian #oil crude exports are dropping as quickly as they did under the 2012-15 US/EU sanctions regime (JPM) #OOTTpic.twitter.com/YSTuYea3uP
1058466276740399105	jpmorgan	1541193000000	12	33	This $JPM program aims to boost the #tech talent pipeline.
1058425064427790340	KimbleCharting	1541183174000	36	55	Divergences similar to 2007 highs taking place as diverging assets attempting to break long-term rising support at each (1). $SPX $JNK $BKX $JPM $ITBpic.twitter.com/AZXCtpsx76
1058362299432534023	HuginHilary	1541168210000	13	132	Lol k but he did turn that company around & make it to every soccer game after he left JPM sooooo... https://twitter.com/BobMenendezNJ/status/1057423015766622209 …
1058231225561767936	Colgo	1541136959000	4	14	Devils & Details LIVE, unplugged, maybe a bit unruly: Nov 27, The Ivy. Tix: https://events.humanitix.com.au/business-insider-presents-devils-and-details-unplugged …  With:  @Scutty @masters_joanne (ANZ) @PeteWargent @MichalakisCon @TheKouk @Eleanor_Creagh (Saxo) @cmkusher (CoreLogic) @jameswhelan42 (VFS) Laura Fitzsimmons (JPM)  Join us!
1058093965906309122	AstridDoerner	1541104234000	2	5	@schaeferdaniel and I had a great talk with #JPM CEO Jamie Dimon in Berlin. On the agenda: #Italy, being a CEO in the age of populism and why he doesn't want to buy #Deutsche Bank  https://www.handelsblatt.com/finanzen/banken-versicherungen/jamie-dimon-im-interview-die-schulden-sind-ein-risiko-jp-morgan-chef-warnt-vor-neuer-krise-in-europa/23256392.html?share=twitter … #Handelsblatt
1058072815692333056	crabbermike	1541099191000	15	27	$FUSZ Pay Attention folks 2 ALL the New Board Members joining @nFuszInc  a .30 stock! @Jim_M_DuBois Ex $MSFT #CIO Erik Nielson, Ex $MSFT @Microsoft Now $LUV Southwest Airlines Chuck Reddie @jpmorgan $JPM Phillip J Bond @usdeptofcommerce + More $AMZN $AAPL $GOOG $FB $NFLX $CRM #AI
1058033539000676357	stuarthenderson	1541089827000	1	9	Congrats to our Tokyo regional round winners!! @tricoghealth and @allworldhealth  see you in January at JPM’19 in San Francisco. @AccentureHealth @AccentureLifSci #healthtechchallengepic.twitter.com/NBGNMTutOM
1057751026986598400	Motorcardiaries	1541022471000	2	11	Loving all the Greg Moore tributes on Twitter today. I never saw him race in person but loved following CART during the 90s. I had this photo cut out of Autosport on my bedroom wall when I was a teenager. Giving JPM the finger at 240mph at Michigan in 1999. pic.twitter.com/L4uJMfakTr
1057690561384247296	ROIChristie	1541008055000	11	62	2019 JPM Long Term Capital Market Assumptions released today. Link below.  Link: https://am.jpmorgan.com/blobcontent/1383581744857/83456/2019%20LTCMA%20-%20FULL%20WHITE%20PAPER.pdf …pic.twitter.com/4BjWhZnily
1057687703465181184	jpmorgan	1541007374000	8	45	Thanks to @Box CEO @levie for joining us at $JPM HQ to discuss technology and the future of work. pic.twitter.com/vixZvQZOm1
1057647010659090432	PatrickW	1540997672000	7	13	Jamie Dimon: We couldn't be seen in any way condoning Saudi behavior but we will continue condoning Saudi behavior. $JPM https://www.bloomberg.com/news/articles/2018-10-30/dimon-says-skipping-saudi-business-summit-accomplished-nothing …
1057645197549461504	canuck2usa	1540997239000	3	5	Note : Ob's banks are very robust today   $JPM - weekly rotation up   $GS - massive bounce off 200sma Daily   $C - look below and now back in the pattern   $MS - potential Monthly hammer off support   $XLF - back in the range
1057638014803996672	realwillmeade	1540995527000	2	11	According to (Goldman JPM and Morgan Stanley)  Hedge Funds, Risk Parity and Balanced Funds are the most underweight equities since 2009. Add in that stock buybacks kick into high gear next week and we should get a nice pop into 2019.
1057626622990397442	retheauditors	1540992811000	6	7	Dimon acknowledged during an @Axios event that pulling out of speaking role at the Future Investment Initiative was "basically a PR move that won't affect Saudi government behavior..." JPM "couldn’t be seen in any way condoning" the murder of Khashoggi. https://www.axios.com/newsletters/axios-pro-rata-66358987-b773-480d-9b6f-98c45b3b38a5.html?chunk=0&utm_source=twitter&utm_medium=twsocialshare&utm_campaign=organic#story0 …
1057613775455576064	LukeGromen	1540989748000	4	12	"JPM CEO Jamie Dimon said escalating trade tensions b/t the US & China are increasingly starting to resemble a trade war, v. just a 'skirmish'."  As we wrote earlier this yr, paraphrasing Graham Allison, "It's going to get worse before it gets worse."   https://www.bloomberg.com/news/articles/2018-10-31/timely-measures-needed-to-counter-slowdown-china-politburo-says …
1057561587748405248	Merrion	1540977305000	12	22	If you look across the river you'll see the huge new JPM building - with space for over 4000 desks.
1057445897771069441	teamcafemartin	1540949723000		9	@TomCaron thank you for this! #teamcafemartin #redsox #worldseries #jpm https://twitter.com/StacySoxPats/status/1056785165580730368 …
1057399209559638016	4Awesometweet	1540938591000	15	25	33% of credit card balances at Capital One are owed by subprime borrowers.   -WSJ  $cof $dfs $jpm @OpenOutcrier @StockCats @jennablan @DiMartinoBooth @TheBondFreak #debt
1057374814858399744	LesliePicker	1540932775000	5	19	Jamie Dimon: “I’m a patriot but not a politician.” He says he doesn’t think there’s any chance he could win a presidential primary because he’s a banker, he’s part of the elite. @danprimack asks whether we’d ever see his name on a ballot; Dimon says, no. $JPM
1057330414656897025	rafat	1540922189000	1	24	I have never ever gotten a cold call from Morgan Stanley, Merrill or JPM that doesn’t sound like a total bro on the other end. Never ever. This spans a decade now.
1057282368266952704	sunchartist	1540910734000	2	8	*JPM'S KOLANOVIC: POTENTIAL RISING FOR YEAR-END ROLLING SQUEEZE
1057011605924397057	charliebilello	1540846179000	329	641	% Below 52-week High... $MCD: -3% $KO: -4% $PG: -5% $WMT: -9% $AAPL: -9% $BRKB: -11% $CSCO: -11% $V: -11% $MSFT: -11% $JPM: -12% $XOM: -14% $BA: -15% $BAC: -19% $GOOGL: -20% $HD: -20% $C: -20% $INTC: -21% $AMZN: -25% $IBM: -30% $NFLX: -33% $BABA: -34% $FB: -35% $TCEHY: -47%
1056901695849054208	jpmorgan	1540819975000	3	24	$JPM's Mary Callahan Erdoes welcomes attendees to #RobinHoodInvestors in New York City.pic.twitter.com/ulaou62qKj
1056733463435534336	zittokabwe	1540779865000	30	168	Drama as JPM gatecrashes stakeholders’ meeting to solve the cashewnut crisis http://mobile.thecitizen.co.tz/news/2304482-4826762-format-xhtml-sw74fvz/index.html … via @TheCitizenTZ
1056690209218277379	SamRo	1540769552000	19	29	"Such broad losses have only occurred twice – during 1970s stagflation and the Global Financial Crisis.” - JPM pic.twitter.com/LSDRnCxG7B
1056666804104372226	Schuldensuehner	1540763972000	65	79	#Recession risk models make some noise: JPM's 12mth-ahead US recession probability index has jumped >30%, the highest since mid-2016. Headwinds are building as the global capex cycle is at risk settling in closer to 4%-5% YoY growth rather than the 5%-6% we have been looking for. pic.twitter.com/qK75z0fM0g
1056161960448876544	SamRo	1540643608000	10	9	“... a mixed message of earnings surprises on the current quarter and a rising number of profit warnings about the future.” - JPM pic.twitter.com/tAoi6Vb528
1055886459813744640	FlitterOnFraud	1540577924000	6	11	Jamie Dimon's intense anger at @BarackObama suddenly makes a lot more sense: $JPM's bank regulator the OCC had prevented it from opening new branches in some states for the bulk of Obama's second term because of rule violations https://www.bloomberg.com/news/articles/2018-10-26/jpmorgan-s-secret-punishment-u-s-halted-its-growth-for-years …
1055885018646659072	jpmorgan	1540577580000	11	38	$JPM to expand giving to small business owners in #Detroit.
1055860237033525248	zeroleverage	1540571672000	32	71	This is how investment banksters, ''gurus'' and ''market wizarrds''  misinform and take away your money. #Kolanovic head of #JPM last week predicted a bullish rebound this week. There are only two scenarios about him : he is ignorant or liar who deceives  https://www.cnbc.com/2018/10/19/jp-morgans-widely-followed-market-analyst-kolanovic-sees-stock-bounce.html …
1055854971839758338	zachdcarter	1540570416000	2	29	i mean, keeping it secret is itself a favor! what principle can possibly justify protecting JPM's reputation this way? the ban dates back to 2012. they can't even plead "it was a crisis / mistakes were made"
1055795649667567616	MichelleF_Davis	1540556273000	41	60	First big scoop on the new beat: For years, the U.S. secretly stopped JPMorgan, the biggest U.S. bank, from expanding. Under Trump-picked regulators, that’s all changing. https://bloom.bg/2Sj8aUt  via @business $JPM
1055632615187902465	jpmorgan	1540517402000	8	25	12 hours, 10 teams, 2 challenges. Student coders and $JPM technologists built solutions for @mindhongkong to support mental health at our first #CodeForGood challenge in #HongKong. http://bit.ly/Code_For_Good pic.twitter.com/9WKKCXG9ys
1055510606650970112	jpmorgan	1540488313000	13	27	Over 80 student coders worked with $JPM technologists to help nonprofits @OhioGuidestone and Refuge Hub. Here's a peak at them developing their ideas at our #CodeForGood challenge in #Ohio.pic.twitter.com/fvRwDBsFkq
1055460494474133505	carlquintanilla	1540476366000	3	12	This is like Q1, says JPM's Camporeale. "If you miss on revenue, you are getting annihilated. That's what late-cycle is all about."  @CNBC @SquawkStreet
1055409805597306880	Super_Crypto	1540464280000	13	40	JPM at Silver 147,892,868oz. This same as JPM accumulating BTC below 2K while Jamie was trashing BTC. No one is buying Silver other than JPM and few silver bugs. -- Thx @Mehrzad_AAhttps://twitter.com/WorldMint1/status/1055212627817783296 …
1055167684906811392	lhamtil	1540406554000	4	26	We've all seen this JPM chart of average intra-year declines in the S&P 500... pic.twitter.com/098iYCUU9b
1055055535140147200	PatrickW	1540379816000	18	19	JPM: Out-of-pocket healthcare spending grew 8.5% in 2017, the fastest pace in three years.   https://www.axios.com/health-costs-poor-families-burden-1540328210-1269aeb0-70a6-4ce8-b5fb-a96f6066744f.html?utm_source=twitter&utm_medium=twsocialshare&utm_campaign=organic …
1054869438913228800	KainaniStevens	1540335447000	2	13	Classy move by the Red Sox as a tribute to the late, great JPM. pic.twitter.com/wWuERR7KDM
1054831745604968448	Schuldensuehner	1540326460000	33	45	Wall St hit hard but major indices were able to bounce enormously from the lows (the SPX was down ~64 points or ~2.3% at the low but finished the day down ~15 points). BUT The main problem remains a breach in the earnings firewall, JPM says. pic.twitter.com/m36zQ7TElZ
1054796732725264384	4Awesometweet	1540318112000	4	13	Over the last year, Customers withdrew $30B  from US Bank accounts that earn no interest.  -WSJ  $JPM $BAC $KRE @DiMartinoBooth @OpenOutcrier @StockCats @jennablan #banks #yield @TheBondFreak
1054788130161807360	MLBPipeline	1540316061000	20	67	Top performers in the AFL Monday:  #Yankees' Florial, Estrada  #Tigers' Soto  #WhiteSox Robert  #Mariners' Miller  #Rangers' JPM  #Braves' Pache  #Marlins' Harrison  #Indians' Chang  #Dbacks' Varsho More: https://atmlb.com/2ScBsEc pic.twitter.com/EHaF7IKb7c
1054747394125033473	charliebilello	1540306349000	216	353	% Below 52-week high... $JNJ: -7% $AAPL: -8% $MSFT: -9% $BRKB: -10% $CSCO: -10% $V: -10% $WMT: -12% $JPM: -13% $GOOGL: -16% $AMZN: -16% $T: -17% $HD: -18% $C: -21% $BAC: -21% $WFC: -23% $INTC: -23% $NFLX: -24% $NVDA: -25% $TSLA: -29% $FB: -31% $BABA: -33% $TWTR: -41% $TCEHY: -42%
1054746061179281409	TheBubbleBubble	1540306031000	49	55	Global Banking Stocks Are Crashing Hard – Just Like They Did In 2008: https://www.zerohedge.com/news/2018-10-23/global-banking-stocks-are-crashing-hard-just-they-did-2008 … @zerohedge $GS $JPM pic.twitter.com/exB4qdkeMp
1054531488971218945	TradeInTheZone	1540254873000		8	While everyone is paying attention to big tech earnings this week, I think the action in banks is most important. $JPM $C $BAC
1054491953356652544	jpmorgan	1540245447000	29	56	$JPM's Silicon Valley office will house more than 1,000 employees.
1054385780146233344	tasosvos	1540220134000	2	5	JPM: "roughly €100– 120bn of bonds could be downgraded from investment grade to high yield during the next recession (...) this raises the prospect of a disorderly transfer of risk between the two markets"  It's in line with our piece back in July, which featured this cool chart pic.twitter.com/gjcbPKnWOs
1054347860823719942	Cristiona1	1540211093000	4	7	@BelfastTrust Many thanks to Ethna, Wendy and @keane_jpm for the high quality care and attention we received today at the urology clinic. A smile and an explanation makes the world of difference in an anxious situation. Thank you so much!
1054336234439487489	knightofdelta	1540208321000	7	6	Removal of taxes on fixed income, foreign investors now had the option to sell treasury bills before maturity.   Triggered the inclusion of Nigerian Bonds into the JPM Sovereign Bond Index. Nigerian corporates found is easier to raise Eurobonds as an aftermath.
1054268045189767170	Daniel_March3	1540192063000	5	15	Not correct to assume it's JPM buying...let me explain.  All we know is the #silver holdings are being 'warehoused' in JPM's vault on an 'eligible' basis (bars that meet the criteria of the exchange, but are not 'currently' available for delivery). https://twitter.com/WorldMint1/status/1053382362191429632 …
1053648760197341185	option_snipper	1540044414000	8	57	Banks chart not significantly better than techs. $bac $jpm both showing big room downside. Surprisingly $gs concluded this week with higher high higher low big green bottom candle. Very interesting to see how this will develop into next few weeks.pic.twitter.com/3FyXfYWgeS
1053476450542616577	CharleyMa	1540003333000		8	Now that JPM is launching a fintech campus in Palo Alto, looking forward to seeing all the other banks in south bay too :).   https://www.cnbc.com/2018/10/19/jp-morgan-ceo-jamie-dimon-bets-on-silicon-valley-with-fintech-campus.html …
1053370226576969728	TedMerz	1539978007000	7	9	Financial firms in the S&P 500 that get the most news coverage are $JPM (974 articles on average a day), $GS (890) and $MS (375). By contrast the press writes two articles a day about Raymond James, ranking $RJF 6th from the bottom. Share performance tells a different story.pic.twitter.com/1O9Ah05IRa
1053352736018837504	jpmorgan	1539973837000	10	32	12 hours, 10 teams, 2 challenges. Student coders and $JPM technologists built solutions for @mindhongkong to support mental health at our first #CodeForGood challenge in #HongKong.pic.twitter.com/9B63ElndHm
1053320891390554112	ChrisDenk	1539966244000	4	9	Some cannot trade the new $VRUS ticker yet. BUY today, as this is a chance to get in at a low price! #BABA #SBUX #TSN #FB #AVLR #SMAR #TLRY #GIS #WFM #NIO #SNAP #TSLA #BAC #YUM #TWTR #AMZN #DOCU #CSCO #NFLX #WMT #BA #CRM #GOOGL #SQ #SVMK #CMG #RTN #VMW #JPM #microcap #OTC #NASDAQpic.twitter.com/ydLz6dxMe3
1053289703062061058	jpmorgan	1539958809000	14	25	Using data and a range of unique resources, $JPM is working to drive change in communities around the world. https://www.insidephilanthropy.com/home/2018/10/8/unique-assets-a-banks-urban-philanthropy-keeps-growing …
1053289193538048000	KimbleCharting	1539958687000	8	9	Bank of Ozarks nearing dual support test after swift 50% decline at (1). Banks continue to struggle this year! $OZK $XLF $JPM $SPY $BLKpic.twitter.com/YdFPrtbt9g
1053255055900659713	pharris667	1539950548000	1	23	Analysts Raises, Cuts, Reiterations $AAPL Raised @ Wedbush to Street High $310 $ADBE Raised @ Wedbush to $270.00 $GOOGL Raised @ CS to $1500.00 $GBT reiterated Outperform @ Oppenheimer PT $74.00 $MSFT raised @ Wedbush to $140.00 $PYPL raised to $103.00 @ JPM
1052922251085926400	CoalitionHPC	1539871201000	10	14	Pre-release #JPM article  http://bit.ly/2MQbGGW  on #NCPGuidelines  4th edition provides overview of national #palliative care guidelines. Complete guidelines will be published online 10.31.18  http://www.nationalcoalitionhpc.org/ncp/ pic.twitter.com/1qvigBujxr
1052778803330568193	Birdyword	1539837001000	3	8	When you see trade data turning south in major economies, shouldn't be much of a surprise: the exports sub-index of the JPM Manufacturing PMI is now below 50. It tracks world trade volumes pretty well and is out months ahead of official data. pic.twitter.com/ddXWk3svbN
1052661951690670081	LISC_HQ	1539809141000	5	6	LISC-led coalitions secured $8.5M in grants thru $JPM's #PRONeighborhoods competition. Check out what the winning teams are doing to attract new businesses, jobs and economic activity to their neighborhoods!http://www.lisc.org/our-stories/story/jpmorgan-chase-fuels-economic-development-philly-milwaukee …
1052605362602422272	Find_Me_Value	1539795649000	6	42	JPM on $BRK Berkshire “shares look cheap”. Target $250/ B share.pic.twitter.com/fg14Z0crmL
