1115700499699896321	TheCitizenTZ	1554838702000	13	41	Inside The Citizen tomorrow 10/4/2019  Government moves to calm Chinese investors. JPM opens tea factory, decries red tape Inside Che’s visit to Tanzania  Don’t miss your copy. pic.twitter.com/g59avaImsf
1115625802744369152	juliaskripkaser	1554820893000	2	23	$ZGNX literally guaranteed to me at JPM that tox is not going to be a problem but thought NDA was "an event" for investors. Technically both true.. tox data is not a problem if it's not there
1115597095983964163	marKatRoss	1554814049000	9	36	CEOs from Goldman $GS, Citibank $C, JPMorgan $JPM and Morgan Stanley $MS are heading to Capitol Hill tomorrow to testify about regulation. @jimcramer's got some educational tips for investors wondering what to watch when CEOs head to DC.
1115570463672029184	PhilipvanDoorn	1554807699000	5	17	Bank earnings preview: The Fed’s moves are squeezing profits once again https://on.mktw.net/2OZA3j7  $C $BAC $JPM $WFC $GS $MSpic.twitter.com/xWfKlAbiYV
1115443129308647424	kerberos007	1554777340000	3	22	JPM, Morgan Stanley And Now Goldman All Warn "It's Time To Hedge" The FOMO Euphoria  First it was JPMorgan then Morgan Stanley now it's Goldman Sachs  - Hmm. Warning   - Big 3 already hedged stealthily - They must know something. They control 80% of all Options Market making https://twitter.com/zerohedge/status/1115392886412070913 …
1115435876081983488	EnergyCynic	1554775611000	1	25	Check out FANG wells in NW Martin Co (2,3,4). Not great IPs at all, this is former Ajax acreage they paid $40k per acre for! Scratched my head on that deal.. more wells like this and FANG will need another overpriced acquisition to plug the crap inventory hole..  Credit: JPM pic.twitter.com/FgqzO6NDr8
1115320678515798016	SecurityWeek	1554748146000	6	15	JPMorgan Chase spends Roughly $600 Million Annually on its Security Efforts, and Employs Around 3,000 People Involved With Cybersecurity - https://www.securityweek.com/600-million-cybersecurity-budget-jpmorgan-chief-endorses-ai-and-cloud … $JPM
1115313587470458880	themotleyfool	1554746455000	5	18	"I want to be very clear that we do not advocate for the repeal of Dodd-Frank. We believe that the strength and resilience of the U.S. financial system have benefited from the law.” — JPMorgan Chase CEO Jamie Dimon  $JPM https://www.fool.com/investing/2019/04/04/5-things-jamie-dimon-just-said-investors-need-to-h.aspx …
1115224353568903173	carlquintanilla	1554725180000	21	53	Downgrades today for:  * Boeing (BAML) * Micron (Cowen) * GE (JPM) * Southwest (RayJay) * Starbucks (UBS) * Harley (Wells) pic.twitter.com/JunGP0SxgF
1115219660151185409	stocktrader300	1554724061000	1	32	This make no sense. JPM had $WYNN as a hold this whole time with a $149 pt. Now the stock jumps up to $140 and they raise the pt a little and finally say buy the stock? How does these people have jobs?!https://twitter.com/OMillionaires/status/1115192507132993537 …
1115192507132993537	OMillionaires	1554717587000	6	22	$WYNN upgraded to Buy from Hold at $JPM - raises PT to $158 from $149
1115154134498512896	MagnusVieSundal	1554708438000	3	19	How long does it take to forget a murder? In Oct, JPM announced that CEO Jamie Dimon would not attend the Future Investment Initiative conference, in the wake of the Khashoggi disappearance. The past week, Mr. Dimon has personally marketed the sale for the new Saudi Aramco bond.
1115039728292835330	michaellebowitz	1554681162000	2	12	Taming human behavior like taming Mother Nature ain’t gonna happen. Keep wishing JPM.
1115030269780742144	TeddyVallee	1554678907000	96	423	JPM questioning if cycles exist:   “The reality is that maybe the word ‘cycle’ is no longer even relevant, given that we have so much unconventional central-bank involvement.”
1115016464585699328	oliviabvoz	1554675615000	5	23	THIS WEEK I’ll be reporting from LAS VEGAS. Besides that, look out for #FOMCminutes & bank earnings in your week ahead!  https://youtu.be/sIcEoLQU21Y  $sol $legh $lnn $sjr $psmt $levi $dal $mbm $bbby $frb $jpm $pnc $wfcpic.twitter.com/SpFp2RE9sj
1114972105634996224	TradersCom	1554665039000	3	7	This week we are back in #earnings season: Big banks Friday, April 12:  JPMorgan Chase $JPM  Wells Fargo $WFC Other earnings to watch include Bed Bath & Beyond $BBY Delta Airlines $DAL & WD40 $WDFC and New IPO #LeviStrauss $LEVI https://traderscommunity.com/index.php/market-talk/1450-market-weekly-april-7-13-2019 …pic.twitter.com/0CDaVgxaG0
1114860914631692288	russian_market	1554638529000	5	10	Cross-asset correlations like that between stocks and bond yields, or commodities versus the dollar, can signal major market turning points - JPM
1114843028957663232	CharmingFawn	1554634265000	4	37	Well... @KingsplayLP is officially the caster with the most JPM (Jokes per Minute) and holds the record for BJPM (Bad Jokes per Minute). :'D  The #LCK is already insane enough, but he improves the feeling so much, good job @SummonersInnDE!  #LCKGER #SKTWIN
1114743824318734336	Terri1618	1554610613000	10	26	$SPY $IWM $QQQ $VXXB big pic update. Major uptrend intact, shallow dips bought. Osc overbought, but can stay that way. Let price action lead you  Wed: FOMC min Fri: #Brexit ?, $JPM 4/15: $GS $C, $AAPL trial starts 4/16: $NFLX $BAC 4/24: $BA $FB $PINS ipo mid Apr $UBER “  late Aprpic.twitter.com/ayrjpG67q8
1114536176579481602	IBDinvestors	1554561106000	5	11	See who's on deck to report earnings - and which #stocks are near a buy point with EPS due. http://ow.ly/FWOf30olDDS  $LEVI $DAL $JPM $WFC
1114523563829145601	eWhispers	1554558099000	102	148	#earnings for the week   $DAL $JPM $RAD $WFC $BBBY $FAST $NC $MSM $SJR $INFY $FRC $WDFC $APOG $LNN $PSMT $SOL $SLP $CAAP $LEGH $SEAC $TRNX http://eps.sh/cal pic.twitter.com/fP3h78k9zV
1114495762585382912	paststat	1554551470000	5	38	backhome 42 yr old non grad  scammed cnbc viewers that he sold  an algo to JPM https://twitter.com/Guruleaks1/status/1112884755266199552 …
1114434060502413313	AbrahamOnMoney	1554536759000	1	14	JPM Guide to Markets https://am.jpmorgan.com/gb/en/asset-management/gim/adv/insights/guide-to-the-markets …  Basicially, major asset classes recouped the temporary decline of 2018 in Q1 2019.   Loving all the headlines ‘billions wiped back unto the stock market’pic.twitter.com/XA1uWMKdCW
1114253375896465412	LibertyRPF	1554493681000	2	19	I was just a few days early.... New post by Brooklyn Investor about "JPM 2018 Annual Report" $JPM: http://brooklyninvestor.blogspot.com/2019/04/jpm-2018-annual-report-website-etc.html …https://twitter.com/LibertyRPF/status/1110624086881984518 …
1114235880657555457	MartiniGuyYT	1554489510000	8	18	I Will follow everyone that retweets and likes the quoted tweet below!  $FET $BNB $BTT $BTC $ETH $TRX $NULS $AAPL $ADA $BSV $JPM $UDOO $FTM $AXPR $PAL $WEED #BITCOIN #CRYPTO #CRYPTOCURRENCYhttps://twitter.com/MartiniGuyYT/status/1114234522047004672 …
1114175114063564800	SunriseTrader	1554475022000	2	12	Financials the laggards today.  Many start reporting next week $JPM $PNC $WFC to name a few
1114166353773105153	SgtObiWan	1554472933000	12	55	XRP is being challenged by JPM Coin and others, says Ikigai Asset Management’s Travis Kling - https://ambcrypto.com/xrp-is-being-challenged-by-the-jpm-coin-and-others-says-ikigai-asset-managements-travis-kling/ … These ppl writing these articles have no clue how Digital Assets work! FUD FUD FUD!!! @digitalassetbuy #XRP #XRPArmy #xrpcommunity #xrpthestandard
1114144578251186176	Zuccarelli	1554467741000	3	16	If you haven’t heard of T. Duckett, you’ll wish she was on the 2020 ticket after reading this: https://nyti.ms/2UzIsyU  #banks $JPM
1114135906036928517	ReformedBroker	1554465674000	28	285	Congrats to JPM for starting this chart in 1999 with the S&P trading 50 times earnings. Let’s see this on rolling 20 year periods, I suspect you’ll get corncobbed https://twitter.com/APompliano/status/1114134208514015232 …
1114098359739068416	ihaterocket	1554456722000	3	7	No favouritism at JPM? "... gender pay gap was 25.7% in 2018, ... ... has widened marginally by 0.1%... ...Women at the bank received bonuses that were 41.2% lower than men..."
1113907591011291148	AustinValue	1554411239000	16	70	Jamie Dimon compilation updated to include latest Annual and Shareholder letter ($JPM): https://drive.google.com/open?id=1zlF5TCnSvuqZMdJX10gqdJZB2iQO8bXF …
1113868675893821440	CNBCTheExchange	1554401961000	3	11	$STZ catches a buzz post-earnings, $JPM CEO Jamie Dimon defends capitalism, $WMT and $TGT buy into the baby boom, algos can't keep up with Brexit news and a $6k fanny pack for millennials? That's Rapid Fire featuring @TheDomino, @LesliePicker and @FrankCNBC on @CNBCTheExchangepic.twitter.com/wTDXqFDbRE
1113810513429798912	AlexChalekian	1554388094000	6	12	J.P. Morgan - #Tesla's 1Q19 vehicle production & deliveries report was substantially worse than expected...Deliveries tracked just 63,000 units vs. JPM 70,500 and consensus as recently as March 27 of 74,930, suggesting materially less 1Q revenue, margin, and free cash flow.
1113803093362249732	carlquintanilla	1554386325000	1	13	Great chart.  $JPM https://twitter.com/jkaraian/status/1113802912831090689 …
1113794559543271425	russian_market	1554384290000	7	14	JPMorgan Advises Hedging Recession Risk as Bonds, Stocks Diverge  Volatility likely to increase with growth ‘not out of woods’  Treasuries point to 70 percent of recession in a year: JPM
1113766244161921024	Zuccarelli	1554377540000		10	Just your friendly reminder that socialism is different from social democracy. Check out the full $JPM letter for more tasty econ nuggets you may have forgotten since college. https://twitter.com/CNBC/status/1113759496126509058 …
1113766167607431168	CGrantWSJ	1554377521000	2	14	How many health care deals has JPM underwritten this cycle? https://twitter.com/carlquintanilla/status/1113764974407704576 …
1113765477904465920	zerohedge	1554377357000	16	34	JPM warns Q1 market revenue expected to be lower by high-teens %
1113764974407704576	carlquintanilla	1554377237000	122	297	“40% of Americans don’t have $400 to deal with unexpected expenses ... 28m Americans don’t have medical insurance .. Simply put, the social needs of far too many of our citizens are not being met.” - Dimon’s annual letter   $JPM https://reports.jpmorganchase.com/investor-relations/2018/ar-ceo-letters.htm …
1113753209342918656	jpmorgan	1554374432000	34	113	$JPM's Annual Report is now available.
1113752803900645376	Chase	1554374335000	15	32	How can we create more economic growth and opportunity in America? In his annual letter, Jamie Dimon outlines long-term solutions. https://bit.ly/2OFWry3  $JPM pic.twitter.com/6xF9hn3xo7
1113751906944475137	StockBoardAsset	1554374121000	10	22	04 Apr - 06:32:26 AM  [RTRS] (JPM.N) - JPMORGAN'S DIMON IN ANNUAL LETTER SAYS "WE ARE PREPARED FOR — THOUGH WE ARE NOT PREDICTING — A RECESSION"
1113750253277204482	TheDomino	1554373727000	4	22	JPMorganChase CEO Jamie Dimon annual letter to shareholders released today (50 pgs):  https://www.jpmorganchase.com/corporate/investor-relations/document/ceo-letter-to-shareholders-2018.pdf … $JPM @cnbc
1113681994422996993	Terri1618	1554357453000	9	20	$SPY $IWM $QQQ $VXXB update. Small reversal near overhead resistance, might consolidate soon. $VXXB possible tight setup next wk  Fri: Jobs 4/10: ECB, Fed min 4/12: #Brexit ?, $JPM 4/15: $GS $C, $AAPL trial starts 4/16: $NFLX $BAC 4/24: $BA $FB $PINS ipo mid Apr $UBER “  late Aprpic.twitter.com/TS7Z9kWG0H
1113668030700113921	_Crypto_Maniac_	1554354124000	10	44	Brad Garlinghouse on JPM Coin - “JPM Coin is a macro good thing for the industry” #xrp #ripplepic.twitter.com/v4kxJUEWAC
1113567335946825728	DomainMondo	1554330116000	24	16	How JP Morgan Chase Became The Largest Bank In The US (video) https://www.domainmondo.com/2019/04/how-jp-morgan-chase-became-largest-bank.html … $JPM #banks #banker #banking #finance #investments #stocks #StockMarket #investing #investorspic.twitter.com/QZJwb6q2C8
1113444772788748288	cjking711	1554300895000	14	69	Near term (1-3 years) cryptoasset price catalysts:  1) Platform tokens on-board billions to crypto ($FB, Telegram, Kik, JPM Coin) 2) Halving event (May 2020) causes selling pressure to fall by 50% 3) More institutional investors are deploying capital   Cc @APompliano @MarkYusko
1113409613850869760	Tony_BATtista	1554292512000	2	17	This is a friendly reminder that $BMY .41 & $JPM .80 are going ex-dividend tomorrow @tastytrade
1113226638064594944	evantindell	1554248887000	16	104	Many interesting slides in the JPM Q2 guide to the markets. Here are a few that caught my eye. 1) Debt to EBITDA by size and style box... large caps have the least debt 2) Valuations by sector... who is paying 17x for energy and 19x for utilities names? Not me... pic.twitter.com/jfsXUK32zF
1113153626824773633	maxjcm	1554231480000	9	17	#JPMorgan Is Hiring For More Blockchain Jobs Than Any Other Wall Street Firm $JPM #VC #fintech #banking #finserv #cryptocurrency #finance #banks #blockchain #regtech #Insurtech @MikeQuindazzi @FGraillot @topcybernews @socialfave @d_zimnoch @BrettKinghttps://drumup.io/s/NIxhJC 
1113128703553388550	Chahali	1554225538000	5	34	Why should he? Every CAG report is one step closer to jail for JPM's nephew Doto. It's neither Bunge nor CCM MPs who actually wants Prof Assad out but the man himself, JIWE. https://twitter.com/TitoMagoti/status/1113127694328365057 …
1113090138014433280	jimcramer	1554216343000	3	27	It would make sense if $JPM wants to get more IPO business that it stabilize LYFT right here and take it back up.  But that's an awful lot of fire power that's needed
1112914796339515394	BankXRP	1554174539000	12	45	The Ledger: Ripple and JPM, Coinbase loves stake, mining blues http://fortune.com/2019/04/01/the-ledger-ripple-and-jpm-coinbase-loves-stake-mining-blues/?utm_source=twitter.com&utm_medium=social&utm_campaign=social-share-listicle …
1112871302824640512	CKJCryptonews	1554164169000	9	27	JP Morgan drops JPM Coin  Embraces XRP. April 1 2019 https://youtu.be/0m8VZSggh-s  US Congress Introduces Two New  Cryptocurrency Bills  Happy Birthday Alana  @eli91166255 CKJ CRYPTO NEWS  #Defyingthelawsofgravity #Dontstopmenow #CKJTV #CKJCRYTONEWS  Thank you Big Mike 
1112826339789324290	cryptoadventura	1554153449000	4	18	JP Morgan drops JPM Coin, embraces XRP | Crypto Insider https://cryptoinsider.com/jp-morgan-drops-jpm-coin-embraces-xrp/ …
1112744500223463425	SuperRare_co	1554133937000	3	49	Exciting announcement! The future of blockchain technology is clear, and as such we are switching our entire platform over to JPM Coin. Bids and purchases will be made in $JPMC, and existing artworks will be re-issued on this visionary private blockchain.
1112682947000393728	digitalassetbuy	1554119261000	12	237	The rumor is that @coinbase will be adding JPM coin today.
1112607872624590848	Bono62Luca	1554101362000	2	5	So."China man PMI comes in strong. Perhaps the single largest headwind overhang the global economy, China, is showing signs of turning"(JPM). Chinext +3.90%. China yields 6bps higher. US ISM man later. Risk on. AKP suffers in elections but looks mkt was already too -ve on TRY
1112541201910194177	SamRo	1554085467000	4	15	Months from inversion to business cycle peak varies, JPM pic.twitter.com/BFyNP444Rk
1112504508414857218	lisaabramowicz1	1554076718000	37	56	Hedge funds are getting more popular again. About a third of respondents to a JPM survey plan to boost allocations to hedge funds, up from 15% in 2018. https://www.bloomberg.com/news/articles/2019-03-31/jpmorgan-survey-sees-hedge-fund-demand-surging-after-a-down-year …
1112422946193244160	MartiniGuyYT	1554057272000	18	25	RETWEET the Quoted tweet, like it and follow me for a chance to win $100 in Wednesdays livestream   winner will be called in stream so you gotta be watching  $FET $BNB $BTT $BTC $ETH $TRX $NULS $ADA $BSV $JPM $UDOO $FTM $AXPR $PAL #BITCOIN #CRYPTO   More updates on Wednesdayhttps://twitter.com/MartiniGuyYT/status/1112419398831296516 …
1112419791606874112	Schuldensuehner	1554056520000	89	135	JPMorgan is raising its 2019 #China GDP growth forecast, from +6.2% to +6.4% following positive PMIs. Will be extremely beneficial to stocks in near-term & should significantly undercut the recent bond rally, JPM says. Says Treasury & Bund prices in particular are very overbought pic.twitter.com/zpBsZcUn7T
1112419398831296516	MartiniGuyYT	1554056427000	40	43	I JUST UPLOADED AGAIN!  BITCOIN and ALTCOIN BULLRUN IS HAPPENING?! HOW TO CAPITALISE!  $FET $BNB $BTT $BTC $ETH $TRX $NULS $AAPL $ADA $BSV $JPM $UDOO $FTM $AXPR $PAL $WEED #BITCOIN #CRYPTO #CRYPTOCURRENCY #leverage  LINK BELOW  https://youtu.be/Wl-nARilOFU pic.twitter.com/kaqap3PMVr
1112342960509730818	fxmacro	1554038202000	9	13	JPM: China: March NBS manufacturing PMI rebounded to 50.5; revising up our 2019 GDP growth forecast to 6.4%. •Forward-looking indicators seem positive hinting at further improvement in manufacturing activity in 2Q...
1112122116076384256	MartiniGuyYT	1553985549000	39	45	FIRST 100 TO RETWEET (the quoted tweet), LIKE AND FOLLOW GET ENTERED INTO TOMORROWS LEDGER GIVEAWAY   IF YOU WANT 2 ENTRYS RETWEET THIS AND THE QUOTED TWEET  $FET $BNB $BTT $BTC $ETH $TRX $NULS $AAPL $ADA $BSV $JPM $UDOO $FTM $AXPR $PAL $WEED #bitcoin #crypto #cryptocurrencyhttps://twitter.com/MartiniGuyYT/status/1112121281435107329 …
1112089294360006656	zerohedge	1553977724000	18	49	"the strong rally in equity, credit and commodity markets over the past quarter has significantly reduced their cushion against growth downside risks." - JPM
1112070341596069888	Terri1618	1553973205000	17	31	Mon: PMI & ISM mfg Tues: Durable Goods Wed: China/US trade mtg Fri: Jobs report,Bank stress test 4/10: ECB mtg 4/12: #Brexit ?, $JPM eps 4/15: $C $GS eps, Major trial starts for: $AAPL $QCOM 4/16: $NFLX $BAC eps 4/25: $INTC $PINS ipo mid Apr $UBER ipo late Aprhttps://twitter.com/eWhispers/status/1111978805223137280 …
1112040625375989766	Halsrethink	1553966120000	25	46	Suspicious deaths of several senior mkt macro information trading systems at JPM, and no news? How could that be inside that sanctum of banking elites? https://twitter.com/RealDavidJensen/status/1111854873857781762 …
1112026180507463683	BambooXRP	1553962676000	5	37	It's 2027 and you live in the USA, just bought a house in Japan in an hour as an investment, the deed is recorded on the blockchain, you request to pull equity out of the home in the form of JPM coin and you move that equity into Tesla Shares because they're about to launch 1/1
1112021670204751877	aantonop	1553961601000	71	196	Bitcoin Q&A: Facebook Coin and JPM Coin https://youtu.be/Plseqktm3G4   Warning: #MrRobot spoilers!
1111854873857781762	RealDavidJensen	1553921833000	5	21	#JPM #JPMorgan #Banking #BankerSuicides #Markets #Finance   JPMorgan Managing Director Dies Suddenly; Has Links to Other JPM Deaths  http://wallstreetonparade.com/2019/03/jpmorgan-managing-director-dies-suddenly-has-links-to-other-jpm-deaths/ …
1111656267963981825	skabooshka	1553874482000	3	37	TSLA IR (today's JPM note): "Does not currently expect to need to raise additional capital"  * FCF+ "over any 12-month period" * minimum cash requirement at $1.5B to $2B. pic.twitter.com/AnyLnYld9A
1111392233763291136	Schuldensuehner	1553811531000	76	107	US yield curve has inverted further, raising fresh concerns about recession risks. There are arguments to be made that "this time is different” in interpreting inversion. There is enough uncertainty around these arguments that we should not dismiss yield curve entirely, JPM warns pic.twitter.com/Z9V9pacjVo
1111334525148299265	MsigwaGerson	1553797773000	113	661	Huyu ndiye JPM. The true colour of JPM. . #TupeweNiniWatanzaniapic.twitter.com/PQYH2SpGsV
1111252594494566401	WTCM3	1553778239000	1	18	Economist on M&A chess game in payments post $FIS/$WP and $FISV/$FDC (cc: $GPN, $PYPL, $MELI, $JPM, $BAC)  https://www.economist.com/finance-and-economics/2019/03/23/fiss-43bn-takeover-of-worldpay …pic.twitter.com/DIIKZHqPMS
1111251311285190659	crabbermike	1553777933000	4	16	$VRRB Soon 2 B on #NASDAQ as $VERB https://www.globenewswire.com/news-release/2019/03/28/1781234/0/en/Verb-Tech-Co-Announces-Business-Partnership-with-Adobe.html#.XJy7EiuRxCo.twitter … #Adobesummit19 #AdobeSummit #adobe #marketo #MKTGNation #CRM $QQQ $MSFT $GOOG $GOOGL $NVDA $IT $AMZN $AAPL $SHOP $EBAY $ADBE $ORCL $CRM $NFLX #stockstowatch #StocksInNews #AdobeInsiders #StocksToTrade #Marketers $GS $JPM
1111248680344911872	gamesblazer06	1553777306000	2	5	$DB & $CBK tell every investor that they have an earnings problem coz of NII & not a capital problem cause their CET1 ratios r 13.6% & 12.9% respectively.. higher than $JPM, $BAC, $C & $WFC. LOL..why capital raise unless their IRBA models are totally bogus - which they are! https://twitter.com/gamesblazer06/status/1111244361084231682 …
1111244966402113536	Cobra08815182	1553776420000	53	73	So @quant_network  has partnered with @Hyperledger and involved with #hyperledgerquilt  ;)  #banks #enterprise #bacs $qnt $xrp $eth $btc $corda $jpm $quorum $xlm $bnb https://twitter.com/Cobra08815182/status/1111244663363641349/photo/1pic.twitter.com/aVNOsDW06T pic.twitter.com/xbuoWBsEpG
1111238550605959168	WallStJesus	1553774890000	5	12	JPM RAISES PT ON $MSFT TO $125 FROM $115 FOLLOWING CONVERSATIONS W/ MANAGEMENT & INDUSTRY CONTACTS
1111211969204441088	LedaGlyptis	1553768553000	3	11	@MeganCaywood throwing down the gauntlet: JPM watch out! The Wonder Girl of FinTech has her eye on America  https://twitter.com/TramANguyen/status/1111195760350167041 …
1111058784783204352	tracyalloway	1553732031000	37	67	JPM says U.S. Treasury yields are trading 20bps below fair value, suggesting market-implied growth expectations have dropped 0.5%-pts over the last two weeks to 1.4% - lower than the Fed’s 1.9% estimate for growth. pic.twitter.com/VcZ2Sdu8gd
1111022680315252741	iava	1553723423000	2	9	Yesterday, #IAVA Research Director @StephMuls spoke on mental health and suicide prevention strategies for veterans at the 2nd Annual Hero’s Journey Symposium with the @JPM_Foundation  Find out more about this and all IAVA's #Big6 issues here --> http://iava.org/policyagenda pic.twitter.com/Y8VkEKuWsL
1111016382332841990	zerohedge	1553721921000	33	100	JPM cuts hundreds of jobs in asset and wealth management   It appears they don't have much faith in Kolanovic's optimistic forecast
1110975608606085120	chigrl	1553712200000	7	6	German IFO posted a large monthly gain in March, JPM views result w/ caution b/c (a) the IFO only managed to realign with the PMI at a level consistent w/ 1.1% GDP growth (b) expectations in the manufacturing sector fell sharply. pic.twitter.com/P7aUCdEmUA
1110974014636199936	ACEethanol	1553711820000	1	7	ACE’s ⁦@blendor⁩ talking #E15 #FlexFuel from the market development perspective ⁦@MPACTTradeshow⁩ with @delossjahnke with JPM Media & ⁦@FarmWeekNow⁩ #MakeAnMPACT19 #FlexFuelForward ⁦@FlexFuelForward⁩pic.twitter.com/8Sq8wj2b0U
1110908440052973568	BluegrassCap	1553696186000	5	27	however, Goldman isnt a legacy issuing bank or merchant acquirer, so to the extent AAPL can rip those fees out over time, it could dramatically lower transaction fees for itself, w Goldman a willing accomplice (vs, eg, JPM who would want to preserve existing economics) pic.twitter.com/5prTS8AcsW
1110734259688345601	hamchuansing	1553654658000	5	14	.@SenWarren Diversion tactic? "Fannie & Freddie Are Way Too Big"-American Banker. It's a well known fact that bnk after bnk (WFC, BAC, JPM, C, DB etc etc) paid  BLNS in fines to F&F for "misleading" them while denying a central role in the Crisis.  Who are the real bad guys here?
1110699500341989382	zerohedge	1553646371000	24	51	"We could see a meaningful put gamma imbalance (dealers short gamma) if the S&P 500 were to sell off to ~2725 (-3%), while a sizable call gamma imbalance would  return if the market were to rally close to ~2850 (+1.5%)." - JPM
1110693710642192384	alpepinnazzo	1553644990000	9	23	JPM: Vega exposure of VIX $SPY $VIX $VXXBpic.twitter.com/KftG8HK1QW
1110645321309278215	russian_market	1553633454000	34	81	Turkish Lira in a beast mode as bears get no borrowing   - Eat this, JPM! pic.twitter.com/uBhSRPmHFz
1110632082559111168	julieverhage	1553630297000	6	33	Devin Ryan of JPM points out a big reason to go after the unbanked rather than trying to convert customers: 90% of customers in its survey said they dont plan on leaving their bank in the next 18 months. Sticky. pic.twitter.com/lIIZIZu75d
1110519154740744193	Bull_Rusher	1553603373000		20	$srpt you have to wonder - data continues support yet uncharacteristic JPM presentation, GS/MS secondary oversubscribed $144, private JPM conf, overweight PT across the board ~$200, BO short list. But shares sell off $30+ from high with XBI outperforming. Something is up.
1110340837160964099	TradersCom	1553560859000	2	6	Biggest $SPX $NDX Stock Losers Last Week* Risks of #biotech and Banks  #Biogen $BIIB -33.45% 21st Century Fox $FOXA -24.61%  Monster Beverage $MNST-11.70% JP Morgan $JPM -6.93% Goldman Sachs $GS -6.67% Continuation or BTFD? https://traderscommunity.com/index.php/market-talk/1431-market-weekly-mar-23-mar-29-2019 …pic.twitter.com/gfzsW9Cmkb
1110324273116340224	CryptoAmb	1553556910000	6	10	JPM coin would not be competing with any cryptocurrency, claims Andreas Antonopoulos https://ambcrypto.com/jpm-coin-would-not-be-competing-with-any-cryptocurrency-claims-andreas-antonopoulos/ … $BTC #ETH $ETH #Ripple #BTC #Bitcoin #Ethereum $xrp #BitcoinCash #Altcoins
1110301144113401856	crypto_beak	1553551395000	3	23	With $xlm/ibm, JPM, quorum and the rest moving in on Ripple's territory it feels like sometime soon we might finally be able to short $xrp into the centre of the earth
