1096068482821775360	HubrisOne	1550158064000	57	248	A big step towards mass education and adoption   JP Morgan Rolls out JPM Coin  . . . #litecoin #litecoinmining #bitcoin #bitcoins #bitcoinprice #bitcoinmining #bitcoinnews #crypto #cryptocurrency #blockchain #ethereum #tayga8 #т8тайга8 #t8 #сетевой #се…https://buff.ly/2E9TiCI 
1096059649730723840	digitalassetbuy	1550155958000	35	182	JPM Coin And Ripple XRP . Adoption Is Here. #xrp #xrpthestandard #xrpcommunity @ripplehttps://youtu.be/uIlXBjutQtc 
1096059215322513408	TheStalwart	1550155855000	37	199	If it turns out that the Blockchain/Coin framework turns out to be a good one for banks  transferring money around, then the JPM Coin should absolutely obliterate Ripple
1096057126756073472	HaileyLennonBTC	1550155357000	54	153	While its CEO, Jamie Dimon, is notorious for his critical comments on bitcoin, ⁦@jpmorgan⁩ is creating its own cryptocurrency.  “JPM Coin" will initially run on Quorum, the bank's private version of ethereum – but not exclusively.  | @CoinDeskhttps://www.coindesk.com/jpmorgan-moving-its-in-house-crypto-to-real-world-trials-report …
1096056146375462913	coindesk	1550155123000	175	353	UPDATE: JPMorgan's "JPM Coin" will initially run on Quorum, the bank's private version of ethereum – but not exclusively. https://www.coindesk.com/jpmorgan-moving-its-in-house-crypto-to-real-world-trials-report …
1096054877371940865	CNBC	1550154821000	122	165	The "JPM coin" is the first cryptocurrency to be created and backed by a U.S. bank. Each coin is redeemable for $1 U.S., and can only be exchanged between JP Morgan clients. https://cnb.cx/2E9cfWq 
1096051582972710912	AbacusJournal	1550154035000	36	139	Unpopular opinion:   The $JPM coin news is not an $XRP and Ripple killer. There are very few global investment banks of scale that can do what $JPM did. Regional banks, small banks, payment processors, remittance firms, all ‘non-IB’ firms remains an $XRP and @Ripple opportunity.
1096046613213138949	ThinkingCrypto1	1550152850000	35	167	See the smoke and mirrors move here guys? Publicly bash bitcoin and crypto while secretly building their own crypto. Also, I GUARANTEE they are accumulating Bitcoin and other Crypto via OTC. This JPM Coin further validates the #Crypto market. #HODL #Bitcoin #XRP #Ethereumhttps://twitter.com/Hugh_Son/status/1096003374896553984 …
1096043937331138560	CNBC	1550152212000	475	762	JP Morgan is rolling out the first U.S. bank-backed cryptocurrency: The JPM Coin. #CNBCCrypto https://cnb.cx/2DEXGsc pic.twitter.com/RqFXQjO6fC
1096043098591907840	hasufl	1550152012000	25	94	Inspired by the new JPM stablecoin, here is a short thread on  - how Bitcoin achieves trust - trusted middlemen - and Bitcoin's true value  (Thread)
1096040711479271424	crypto	1550151443000	125	215	LATEST: JPMorgan has successfully tested a cryptocurrency "JPM Coin" it plans to use in trials for clients of its wholesale-payments business https://bloom.bg/2DCFIXl pic.twitter.com/sMqdkPam0N
1096037932740227072	cz_binance	1550150781000	286	1.4K	First they ..., then they ..., then they..., then you win!  Welcome to the real world, JPM! https://twitter.com/JasonMeyersNYC/status/1096035284444217345 …
1096028749928239106	Dave_Jonez_02	1550148591000	127	452	JPMcoin is good for JPM but MUFG doesn't trust JPMcoin and has MUFGcoin and Citi doesn't trust either and has Citicoin.   You see the problem here? Same problem that exists today.  They need a neutral, 'supra-bank coin' WITHOUT counterparty each can use to bridge/transact.  $XRPhttps://twitter.com/Cointelegraph/status/1096019092170043393 …
1096027004888002561	econoar	1550148175000	49	115	JPM Coin will start on Quorum, an Enterprise focused version of Ethereum.   In reading the FAQ and articles, they clearly have bigger plans than this initial pilot, including expanding the coin to the public chain.   https://www.jpmorgan.com/global/news/digital-coin-payments …pic.twitter.com/Wlh5fBn0Dc
1096003990226120709	XRPMichaelB	1550142688000	32	137	Now this is a "Banker's Coin"  The first cryptocurrency created by a major U.S. bank is here – and it's from J.P. Morgan Chase.   "JPM COIN"   Thoughts... @HammerToe @XRPTrump @haydentiff https://www.cnbc.com/2019/02/13/jp-morgan-is-rolling-out-the-first-us-bank-backed-cryptocurrency-to-transform-payments--.html?__source=twitter%7Cmain …
1096003374896553984	Hugh_Son	1550142541000	533	896	SCOOP: @jpmorgan, whose leader Jamie Dimon has bashed bitcoin as a fraud, just created its own cryptocurrency. Behold, the JPM Coin  https://www.cnbc.com/2019/02/13/jp-morgan-is-rolling-out-the-first-us-bank-backed-cryptocurrency-to-transform-payments--.html …
1095818507256823808	mark_hruska	1550098466000	2	27	How many #bears are ready to see something like this?   #meltup #fake #notreal $SPX #ES_F $ES_F $ES $SPY $SVXY #VIX $TVIX $UVXY $VXXB $VIX $VVIX $OEX $XHB $UPRO $SPXL $SPXS $EDC $EDZ $QQQ $NASDAQ $NDX $NQ $AAPL $AMZN $FB $NFLX $BA $TSLA $JPM $BABA $BAC $GOOG $GOOGL $WMT $XOMpic.twitter.com/OyRWFoGX0Y
1095738478401372161	Tiny_AIM	1550079385000	8	18	#ARS 6 times average daily volumes. JPM have definitely turned some heads today.
1095734649626812416	Trader__007	1550078472000	14	22	Bigger news to come Doc IMO. However JPM taking nearly 10% of a company this size shows confidence.  Also shows how bullish they are on Copper.....#ARS
1095719586488561664	Styledgentleman	1550074881000	6	10	#ARS - great to see a nice rise today . Long way to go till it’s back nearer true value . JPM obviously see and understand how cheap it still is . Big gap at 10p to fill is first short term target
1095688911400009728	42_panic	1550067568000	21	28	#ars commercial discussions with potential partners mentioned in previous RNS and now JPM increasing their position . Join the dots... pic.twitter.com/pf2o1pf7oq
1095682362258702336	Martin_AIM_77	1550066006000	8	15	Meanwhile #ARS continues with no stopping... perhaps some other institutions TR1 will be coming in as this is quite some heavy buying after JPM.
1095674770450989056	HayekAndKeynes	1550064196000	22	50	Breakout of Chinese stimulus & comparison to prior slowdowns.   The JPM number is bigger than mine as they include additional estimates. Note that the total does not include RRR cuts.   (courtesy of @0Deflation)pic.twitter.com/W2h7imOpQo
1095663595931750400	geo_meda	1550061532000	7	10	Good that #Ars rises at the back of JPM bought more.  Now we need #MTR to rise soon as placing done at premium and Sprott fund manager is increasing their stake to near 20%!
1095662223823908864	StantonStocks	1550061205000	8	13	#ARS still seriously undervalued.  With lots of news due, JPM endorsement & potential deals in the pipeline I can see a quick return above 10p here https://twitter.com/bobbyoflondon/status/1095618113008209921 …
1095623749850800128	Trader__007	1550052032000	9	16	JPM have been big supporters of Asiamet as have Asipac & the Exceutive Chairman Tony Manini.....I suspect bigger news is coming hence clearing up formal rns news such as significant shareholders now ! #ARS
1095620049975607296	Lazerblue	1550051150000	27	36	JPM up to 9.37% of #ARS , significant demonstration of belief in the assets , more importantly shows that they have been adding during recent weakness and not selling as per some spooked retail. Medium to long terms returns are off the scale at this price......
1095407056897613826	Chase	1550000368000	6	18	Leaders across industries came together at the launch of Advancing Black Pathways to discuss bringing new opportunities to more Black Americans. Hear from @MellodyHobson and $JPM's Chairman and CEO, Jamie Dimon. Learn more at http://www.jpmorganchase.com/abp pic.twitter.com/LBMb7bC5ob
1095385321015934976	RebeccaDRobbins	1549995186000	8	17	At #jpm19 last month, I met investor Dennis Purcell, who is an OG JPM attendee. Read his great op-ed on what the conference was like in the '80s: https://www.statnews.com/2019/02/12/make-jpm-healthcare-conference-better/ …
1095367572348907520	crabbermike	1549990954000	11	14	$FUSZD @VerbTech_Co #taggCRM With Huge Partners & ex #CIO of #Microsoft $JPM Managing Director on #Advisory AS WELL AS #SHAREHOLDER, other #jpmorgan execs following #verb pay attention! #NASDAQ bound! $TWTR $MSFT $SPY $QQQ $BA $GS $AMZN $AAPL $NFLX $FNMA $SIRI $CRM $IBM $JNJ $MUpic.twitter.com/vKpE38TKXF
1095285952057090049	bradloncar	1549971495000	18	42	Awesome write up on the history of JPM by the legend, Dennis Purcell. https://www.statnews.com/2019/02/12/make-jpm-healthcare-conference-better/?utm_source=STAT+Newsletters&utm_campaign=c64e3ce9a0-Readout_COPY_03&utm_medium=email&utm_term=0_8cab1d7961-c64e3ce9a0-149530313 …
1095170643853799432	jpmorgan	1549944003000	21	40	. $JPM Chairman and CEO Jamie Dimon gives closing remarks at the launch of Advancing Black Pathways. http://spr.ly/6011ErkRS pic.twitter.com/0ZRjA9s81d
1095155540165050369	jpmorgan	1549940402000	15	37	President of Ariel Investments @MellodyHobson  on the benefit of $JPM's new program: "We're ultimately advancing every pathway in America."  http://spr.ly/6018ErkHp pic.twitter.com/CRNpFDIPgz
1095147988740198402	jpmorgan	1549938602000	10	32	"We're hiring Black scholars in order to develop young talent," says the $JPM head of Advancing Black Pathways. http://spr.ly/6016ErXL2 pic.twitter.com/Fk8DyJsDdw
1094686613001723905	SamRo	1549828601000	12	14	JPM: “Our Global equity strategists believe that the January risk rally is not a dead cat bounce, but that it will become more fundamental as Fed pause is digested…" pic.twitter.com/DniVn77fvh
1094664750720577537	lockena5a2	1549823389000	4	16	I had said it clear it doesn’t matter to JPM as long as he gets his cut period.Why all shoddy deals are inked at the state house it’s a million dollar question.Your remember there was no due diligence on Yapi Merkezi the SGR contractor the same as Arab Contractors for Stiglers?
1094356393610670081	TurkandH	1549749871000	3	9	Yep- let's do a retroactive nationalization of JPM, GS, AIM, GM, F, WFC, USB, BAC, C, the list goes on.....
1094274497983721473	gaittman	1549730345000	2	29	Target Ganassi with JPM at the wheel. The perfect CART combo. pic.twitter.com/aZwHl58G7p
1094004933626654722	zerohedge	1549666076000	49	100	Robots are about to overtake human traders: The share of passive in US domiciled equity funds will exceed 50% within 2-3 years: JPM
1094003782403395584	zerohedge	1549665801000	14	29	JPM: "The shift from active to passive accelerates."  BBG: "Stock Pickers Are Fired Up as Passive Funds Shed $16 Billion"
1093948059929718786	crabbermike	1549652516000	5	9	$FUSZD @VerbTech_Co The Big Boys $CRM $IT $MSFT $ADBE $ORCL @ODOO #Marketo already onboard, what others R as well? Oh, $JPM Managing Director ex $MSFT #CIO $LUV.#Salesforce members all on #advisoryboard #boardofdirectors tick tock #Nasdaq bound! $amzn $aapl $googl #stock #stocks
1093870215635574784	HedgeFundTips	1549633957000	2	4	Be in the know. 7 key reads for Friday: https://www.hedgefundtips.com/be-in-the-know-7-key-reads-for-friday/ … $FB $VZ $IBM $PFE $XOM $CVX $KO $JPM $PG $CSCO $MRKpic.twitter.com/0h4dVFISoF
1093827457738854400	james_newbold	1549623762000		9	Reasons why I love my job, part 1. Getting to interview legends of motorsport in JPM and JYS (three letter acronyms are the best) for a cover feature that includes a shot from the first #F1 race I ever remember watching.pic.twitter.com/G025hmN3Yp
1093736674616590337	ZahirAlly	1549602118000	3	7	When our Leaders talks and defend this good Country. It make's me feels Proud. Viva CCM, Viva President JPM!
1093691662436491264	darshanvmehta1	1549591386000	3	15	Cadila Health Bofa cuts target to Rs 368 from Rs 381  CLSA cuts target to Rs 400 from Rs 430 HSBC cuts target to Rs 400 from Rs 420 JPM cuts target to Rs 355 from Rs 375
1093593274542186498	jpmorgan	1549567929000	10	19	$JPM's Joyce Chang discusses developments in blockchain and cryptocurrencies with @business.http://spr.ly/6016ERahM 
1093558643985911810	daChartLife	1549559672000	1	10	JP Morgan and S&P in top chart (monthly data updated for today) and JPM / S&P in bottom chart.  2 take-aways: (1) it's pretty hard for the S&P to do well if JPM does not and (2) JPM / S&P is retreating from historic highs at a time when big banks/big brokers act poorly. pic.twitter.com/RbYDoHjMGB
1093544927265542146	ivanhoff2	1549556402000	4	8	$JPM is back below its 50-day moving average. Let's see how it closes. It's a bellwether for financial stocks. @MarketSmithpic.twitter.com/izXnXBCcB5
1093524164051431424	Super_Crypto	1549551452000	4	37	Nothing going to happen with this demand. At the same time this is good development. #Silver Paper Fraud will be exposed one day.....JPM has accumulated 145 million ounces of physical Silver. They win either way. - More Silver. Little #Gold & #BTC for me! https://medium.com/@super.crypto1/where-is-the-future-bull-market-bitcoin-or-silver-2e2dca550c49 …https://twitter.com/SilverGold_News/status/1093175833219485704 …
1093137031641866245	lisaabramowicz1	1549459152000	31	69	By using the word "patience," the Fed is giving markets three months of a reprieve from rate hikes, according to JPM's Tom Kennedy, who worked at the New York Fed for a decade under Dudley. After that, however, rate hikes will be back on the table. https://www.bloomberg.com/news/audio/2019-02-05/scooping-up-laggards-that-missed-bond-rally-kennedy-radio …
1093099605036859392	StockBoardAsset	1549450229000	4	10	JPM Global PMI New Export Orders are in contraction, points to a rapidly slowing global economy pic.twitter.com/itmJGUcAji
1092602688120991744	Colgo	1549331755000	4	7	JPM: Details of Australia's trade data today "unequivocally weak"   Imports declined 6% MoM, one of the largest declines on record -- worrying sign for domestic demand
1092489777239203843	irritatedwoman	1549304835000	2	4	Here Are The Three Companies Apple May Buy Next, According To JPM | Zero Hedge https://www.zerohedge.com/news/2019-02-04/here-are-three-companies-apple-may-buy-next-according-jpm …
1092441759102181376	Biotech2050	1549293386000	3	12	JPM - $SGMO: Quick Thoughts into MPS I & II Updates at WORLD (02/07)https://www.investorvillage.com/smbd.asp?mb=1933&mn=120062&pt=msg&mid=19104638 …
1092436913032699904	lisaabramowicz1	1549292231000	8	18	Apple should buy Netflix, JPM analysts suggest. https://www.bloomberg.com/news/articles/2019-02-04/apple-acquisition-targets-could-include-netflix-sonos-jpmorgan …
1092435596814024704	mike_levitt	1549291917000	2	19	Murph got JPM to sign the print, but missed Greg who left early to nurse his hand.  Murph figured he could get Greg to sign it "anytime."  The next day, Greg was killed.  For the next several years, really crappy low res versions started to circulate on the web.
1092433303716667392	mike_levitt	1549291370000	2	23	where Greg got really loose, but managed to gather it up and avoid hitting the wall.  The next time by Greg was half a lap behind.  But the lap after that he went blowing past JPM with his hand in the air and finger raised.  Keep in mind that he was probably going 240MPH....
1092423775637913607	crabbermike	1549289099000	10	15	$FUSZD #GameChanger Now Verb Technology Corp Inc. #taggCRM $ADBE #ADOBE A NEW #PARTNER SEPERATE FROM #MARKETO FOLKS! https://twitter.com/crabbermike/status/1092231774774517760?s=19 … $AAPL $MSFT $ADBE $CRM $IT $JPM $AMZN $NFLX $C $GOOGL $FB $QQQ $BAC $INTC $IBM $PCLN $SIRI $SAP $TSLA #STOCKS #STOCKSTOWATCH #STOCK #CRM
1092417359707627520	zerohedge	1549287569000	19	44	Fed’s Balance Sheet Runoff Has Had ‘Limited Impact’ on USTs: JPM  So JPM, DB and Goldman all think the unwind of QE is a nothingburger and Powell is a chump.
1092407213598146561	WallStJesus	1549285150000	3	12	* $LRCX REMAINS JPM TOP SEMI PICK FOR 2019, REITERATES OVERWEIGHT RATING $190 PT
1092395770874085377	marfgilbert	1549282422000	4	10	JPM looks what Apple might buy *if* it wanted to make a large acquisition  lists: Netflix, Activision, Zynga, Sonos, Peloton pic.twitter.com/qOvxm5qxhC
1092137865071546369	nategeraci	1549220932000	3	9	Top 10 ETF issuers today vs 5yrs ago (data via @ETFcom)...  -"Big 3" total mrkt share virtually unchanged -BlackRock AUM nearly as much as total industry AUM 5 yrs ago -Schwab ↑ -State Street ↓ -JPM cracks top 10 pic.twitter.com/ad4yWCMcHO
1092085053864198144	crabbermike	1549208341000	6	13	$FUSZ $VERB #VERB #TAGG "Something Wicked Cool Coming This Way" Clock is At 5 Hours 20 Minutes folks #GAMECHANGER https://nfusz.com/  #Technology #Tech #Sales #Video #Marketing #CRM #ArtificialIntelligence #SaaS #CLOUD #Salesforce #Microsoft #Google #Apple #Amazon #Adobe $JPM
1091538533863620608	phojoknight	1549078040000	5	13	McCaskey stuns Cedar Crest with a last second shot to win it 60-58 in Lancaster Friday night @LancasterSports @LancasterOnline @JWalkLNP @JPM_RedTornados @CCHS_Hoops @CLSD_Schools #LLbasketball #LLsports #basketball #McCaskeypic.twitter.com/z5WNz1SJKs
1091401076270657541	yvsx	1549045268000	32	257	Andrew Lim of  Societe Generale downgraded $GS $MS to Sell   @ReformedBroker take on the downgrade LOL  $BAC $JPM $WFC $Cpic.twitter.com/FStoAJHWlv
1091338848687271938	HedgeyeDDale	1549030432000	5	37	"Forecasting the short-term path of long-term rates is extraordinarily difficult, which is why we've seen many macro strategies fold in recent years." -Oksana Aronov, JPM  Not if you use the @Hedgeye GIP Model.pic.twitter.com/E1B9vApbQO
1091310042475913217	Research_Turkey	1549023564000	2	6	JPM/Turkey: Turkey: Rebalancing and deleveraging fast -Plunging dom.demand and increased competitiveness have sharply reduced the CA deficit -Tight policies have aided this adjustment -Banks and corporations have deleveraged without large-scale defaults or debt restructuring pic.twitter.com/5V3wEsPOlo
1091081899353751554	charliebilello	1548969170000	348	831	January... S&P 500: +8% Dow: +7% Nasdaq 100: +9% Russell 2000: +11% Crude Oil: +19% $FB: +27% $AAPL: +5% $AMZN: +14% $NFLX: +27% $GOOGL: +8% $C: +24% $GS: +19% $MS: +7% $BAC: +16% $JPM: +7% *** Gold: +3% High Yield Bonds: +5% Agg Bonds: +1% REITs: +12% Volatility Index $VIX: -35%
1091041835705720832	ddayen	1548959618000	4	6	This could have gone worse, Citi and JPM have been lobbying to be included. But of course, this is only a proposed rule. During Dodd-Frank implementation the bank lobbyists saw this period simply as the second half of the game. https://twitter.com/vtg2/status/1091036492804300800 …
1090995499103076353	modestproposal1	1548948571000	3	21	Phil Cusick from JPM on 5G pic.twitter.com/vxM3bwO1bh
1090958832644296705	carlquintanilla	1548939829000	3	11	JPM: " ..it is clear to us that Facebook is back on the offensive .. While Facebook still has much work to do, it is clear to us that management now feels more comfortable increasing its efforts around new products and experiences."  $FB
1090951428238180352	UPBOptionMil	1548938064000	5	10	Some of todays top open interest changes 1.31.19  $GE $MSFT $FB $TWTR $JPM $AAPL $VALEpic.twitter.com/cM6OZm2DZF
1090761590473924613	Saba_Capital	1548892803000	3	15	looking forward to Moody's, GS, JPM upgrades tomorrow  and Zach Kirkhorn will do a great job.
1090685312177766405	WilfredFrost	1548874617000	48	188	$JPM CEO Jamie Dimon tells me "I believe that individuals earning the most can afford to pay more, and I have no problem paying higher taxes to address some of the fundamental challenges and inequities in our society". pic.twitter.com/SybZoS1FRk
1090380835981795330	Frances_Coppola	1548802024000	6	13	Spot on. All JPM missed was the dummy-throwing and foot stamping. https://twitter.com/BruceReuters/status/1090378698736455682 …
1090240909478772736	PipsToDollars	1548768663000	4	7	Airlines upgraded this am by JPM - $UAL United Continental stock price target raised to $101 from $95 at J.P. Morgan  - $DAL Delta Air Lines stock price target raised to $62 from $59 at J.P. Morgan  - $AAL American Airlines stock price target raised to $43 from $40 at J.P. Morgan
1090235697120927744	chigrl	1548767420000	24	46	JPM: Probability of recession beginning with one year (percent) pic.twitter.com/CkzcE6ba8h
1090102277875138564	FT	1548735610000	14	17	JPM Asset Management wins go-ahead to sell funds into China https://on.ft.com/2G7vG3c 
1090089899557089280	TeslaCharts	1548732659000	2	45	So did this highly sus Saudi/JPM $TSLA hedge create the first documented 'long squeeze' on January 18th???  
1089952340017242113	passthebeano	1548699862000	2	11	The plot thickens... $TSLA $JPM https://twitter.com/retheauditors/status/1089950745179418625 …
1089950745179418625	retheauditors	1548699482000	8	38	Hey Sam,  Did you notice JPM, Tesla audited by PwC and PwC is biggest most important advisor to Saudi Vision 2030?
1089936218664652800	TeslaCharts	1548696019000	3	43	Somebody was on the other side of this trade... $TSLA $JPM https://twitter.com/markbspiegel/status/1089934243994710017 …
1089931363061383177	markbspiegel	1548694861000	2	66	So as the Saudis allegedly put this giant $TSLA hedge on after the close on the 17th, does that mean they royally fucked over their bankers at $JPM, who would've had no time to lay off the risk themselves before the plunge on the 18th?
1089901164580225025	AbacusJournal	1548687661000	3	6	GOLDMAN SACHS: INSTAGRAM STORIES: Goldman Pushes Blockchain Virtues Via Social Media Spend (pics) https://abacusjournal.com/?p=6100  **Seems @GoldmanSachs doesn’t think blockchain is ‘overhyped’. $JPM
1089886216466714625	lisaabramowicz1	1548684097000	51	84	Debt-financed buybacks fell to 14% of the total among U.S. companies at the end of last year, the lowest level since 2009: JPM data via @TheTerminalpic.twitter.com/FqS0oHoNFA
1089879656168214528	Stock__Master	1548682533000	4	11	8K ALERT on $SHLDQ  MC of $60Million  #Sears #Kmart $OCSY $GE $BAC $F $FCX $JCP $CHK $AUY $PBR $CLF $WFC $AA $ABBV $KMI $DIS $TSM $BK $PM $JPM $NOK $GGP $ORCL $PFE $KEY $BB $C $IBM $WMB $BABA $RF $MRO $NBR $ABX $ITUB $AAPL $S $XOM $C $JPM $NVCN $BACpic.twitter.com/TxSeuVcOcm
1089840368898793472	lisaabramowicz1	1548673166000	17	17	JPM thinks stocks & corporate debt will rally more if the Fed confirms that it plans to stop hiking rates for now. https://www.bloomberg.com/news/articles/2019-01-28/jpmorgan-says-equities-credit-still-haven-t-priced-a-fed-pivot …
1089838002510143488	BarkowConsult	1548672602000	6	16	Crypto Diss  $JPM and @McKinsey on #blockchain adoption issue:  JPM: https://www.reuters.com/article/us-crypto-currencies-jpmorgan/crypto-value-unproven-blockchain-years-away-from-mainstream-jp-morgan-idUSKCN1PI2E9 …  McK: https://www.mckinsey.com/industries/financial-services/our-insights/blockchains-occam-problem?cid=other-eml-nsl-mip-mck&hlkid=b1f4bbfb01e9493f8a773f0a90593cc6&hctky=9896233&hdpid=5d3dfefe-4c3d-4e22-81ce-53fa512c8796 … #FinTech #Blockchainpic.twitter.com/cywcRy7it7
1089826947176251393	BitcoinErrorLog	1548669966000	1	66	Such statements should include disclosure of how much cryptocurrency JPM and its subsidiaries have exposure to.
1089623328455835648	Super_Crypto	1548621420000	5	33	#CME published specs in 2017 #Bitcoin ran few thousand #USD. #BAKKT published specs in 2019 & BTC is searching for the bottom :) -- What difference? 2017: #JPM #BTC long  2018: #JPM #BTC short -- Understand BASICS of #Geopolitics https://medium.com/@super.crypto1  -- via @Vanamonde1https://twitter.com/cryptomanran/status/1089405212299808769 …
1089549415465967616	thejadedtrader	1548603798000	3	22	$VKTX $MDGL great synopsis of the NASH players from JPM a few weeks ago:  “We continue to think Gilead is lacking a good mid- or late-stage cardiometabolic NASH drug," Raymond James analyst Steven Seedhouse wrote in a Jan. 7 investor note.  https://www.biopharmadive.com/news/nash-2019-jpm-readouts-deals-market-competition/545772/ …
1089360549446672384	EmptyBox_007	1548558768000	6	57	JPM calling other drivers bonehead is just about the best thing in racing.
1088566171346128899	jpmorgan	1548369374000	9	15	Cohen at #WEF19: At $JPM we have allies across all our business groups. The ally concept is a collective effort. Everybody has a role, and you want people to feel that they are in a safe environment. pic.twitter.com/RiOib8fRW8
1088565005786775553	jpmorgan	1548369096000	12	17	CEO of $JPM's International Private Bank, Andrew Cohen, and the head of our Women on the Move program, Samantha Saperstein, joined Mark Thompson, CEO of the New York Times in the @femalequotient lounge at #WEF19 to discuss bringing men to the table as allies.pic.twitter.com/tH0W0Onujs
1088546468250730499	fxmacro	1548364676000	16	36	JPM: Marking down Q1 GDP again, from 2.0% to 1.75%...
1088522167606829057	KLemkau	1548358883000	3	17	Two of our $JPM panelists at Davos @femalequotient - Jamie Dimon and @AdamMGrant  Two of the best allies of all time.https://twitter.com/femalequotient/status/1088503812090941441 …
1088495586121256960	marshallpruett	1548352545000	4	48	The Week In Sports Cars, Jan 23, with Juan Pablo Montoya https://racer.com/2019/01/23/the-week-in-sports-cars-jan-23-with-juan-pablo-montoya/ … via @racermag JPM's tale of drifting his @Acura @Team_Penske @IMSA DPi in the rain @DISupdates is priceless... #Rolex24 #IMSA50pic.twitter.com/GXozMMFmwX
1088474788321026048	YahooFinance	1548347587000	10	10	The economy will never recover much of the losses from the government shutdown, JPM's Erdoes says https://yhoo.it/2Dwr4lC  by @sallypancakespic.twitter.com/hGZIRmnj7j
1088440841566281730	Insidef1	1548339493000	233	823	Michael Schumacher - Suzuka 2001 Qualifying - He was Untouchable.  Love the looks on JPM and Rubens faces after Michael set that time!!    Enjoy the Sound, It's V10 Screaming  #F1 #KeepFightingMichaelpic.twitter.com/rGfdADb44c
